{
  "$schema": "http://json-schema.org/draft-07/schema#",
  "$id": "https://aos-data.org/schema/lore.schema.json",
  "title": "Lore",
  "description": "A spell lore, prayer lore, or manifestation lore for Age of Sigmar",
  "type": "object",
  "properties": {
    "$schema": {
      "type": "string"
    },
    "id": {
      "type": "string",
      "pattern": "^[a-z0-9-]+$"
    },
    "name": {
      "type": "string"
    },
    "loreType": {
      "type": "string",
      "enum": [
        "spell",
        "prayer",
        "manifestation"
      ]
    },
    "factionId": {
      "type": "string",
      "pattern": "^[a-z0-9-]+$"
    },
    "spells": {
      "type": "array",
      "items": {
        "type": "object",
        "properties": {
          "name": {
            "type": "string"
          },
          "castingValue": {
            "type": "integer",
            "minimum": 2,
            "maximum": 12
          },
          "timing": {
            "type": "string"
          },
          "declare": {
            "type": "string"
          },
          "effect": {
            "type": "string"
          },
          "keywords": {
            "type": "array",
            "items": {
              "type": "string"
            }
          },
          "color": {
            "type": "string",
            "enum": [
              "Black",
              "Blue",
              "Gray",
              "Green",
              "Orange",
              "Purple",
              "Red",
              "Yellow"
            ]
          },
          "abilityCategory": {
            "type": "string",
            "enum": [
              "Offensive",
              "Defensive",
              "Movement",
              "Control",
              "Special",
              "Rallying",
              "Shooting"
            ]
          }
        },
        "required": [
          "name",
          "castingValue",
          "effect"
        ],
        "additionalProperties": false
      }
    },
    "prayers": {
      "type": "array",
      "items": {
        "type": "object",
        "properties": {
          "name": {
            "type": "string"
          },
          "chantingValue": {
            "type": "integer",
            "minimum": 2,
            "maximum": 12
          },
          "timing": {
            "type": "string"
          },
          "declare": {
            "type": "string"
          },
          "effect": {
            "type": "string"
          },
          "keywords": {
            "type": "array",
            "items": {
              "type": "string"
            }
          },
          "color": {
            "type": "string",
            "enum": [
              "Black",
              "Blue",
              "Gray",
              "Green",
              "Orange",
              "Purple",
              "Red",
              "Yellow"
            ]
          },
          "abilityCategory": {
            "type": "string",
            "enum": [
              "Offensive",
              "Defensive",
              "Movement",
              "Control",
              "Special",
              "Rallying",
              "Shooting"
            ]
          }
        },
        "required": [
          "name",
          "chantingValue",
          "effect"
        ],
        "additionalProperties": false
      }
    },
    "_meta": {
      "type": "object",
      "properties": {
        "lastUpdated": {
          "type": "string"
        },
        "source": {
          "type": "string"
        }
      },
      "additionalProperties": false
    }
  },
  "required": [
    "id",
    "name",
    "loreType"
  ],
  "additionalProperties": false
}
