{
  "$schema": "https://aos-data.org/schema/lore.schema.json",
  "id": "manifestations-of-doom",
  "name": "Manifestations of Doom",
  "loreType": "manifestation",
  "_meta": {
    "lastUpdated": "2026-01-07",
    "source": "BSData import"
  },
  "spells": [
    {
      "name": "Summon Bell of Doom",
      "castingValue": 7,
      "timing": "Your Hero Phase",
      "effect": "Set up a **Bell of Doom** wholly within 13\" of the caster, visible to them and more than 9\" from all enemy units.",
      "keywords": [
        "**^^SPELL^^**",
        "**^^SUMMON^^**"
      ],
      "declare": "If there is not a friendly **Bell of Doom** on the battlefield, pick a friendly **^^Skaven Wizard^^** to cast this spell, then make a casting roll of 2D6.",
      "color": "Yellow",
      "abilityCategory": "Special"
    },
    {
      "name": "Summon Vermintide",
      "castingValue": 7,
      "timing": "Your Hero Phase",
      "effect": "Set up a **Vermintide** wholly within 13\" of the caster, visible to them and more than 9\" from all enemy units.",
      "keywords": [
        "**^^SPELL^^**",
        "**^^SUMMON^^**"
      ],
      "declare": "If there is not a friendly **Vermintide** on the battlefield, pick a friendly **^^Skaven Wizard^^** to cast this spell, then make a casting roll of 2D6.",
      "color": "Yellow",
      "abilityCategory": "Special"
    },
    {
      "name": "Summon Warp Lightning Vortex",
      "castingValue": 7,
      "timing": "Your Hero Phase",
      "effect": "Set up the first part of the **Warp Lightning Vortex** within 18\" of the caster and visible to them, then set up the second and third parts exactly 7\" from the first part and exactly 7\" from each other so that they form a triangle.",
      "keywords": [
        "**^^SPELL^^**",
        "**^^SUMMON^^**"
      ],
      "declare": "If there is not a friendly **Warp Lightning Vortex** on the battlefield, pick a friendly **^^Skaven Wizard^^** to cast this spell, then make a casting roll of 2D6.",
      "color": "Yellow",
      "abilityCategory": "Special"
    }
  ]
}
