{
  "$schema": "https://aos-data.org/schema/lore.schema.json",
  "id": "bestial-manifestations",
  "name": "Bestial Manifestations",
  "loreType": "manifestation",
  "_meta": {
    "lastUpdated": "2026-01-08",
    "source": "BSData import"
  },
  "spells": [
    {
      "name": "Summon Doomblast Dirgehorn",
      "castingValue": 6,
      "timing": "Your Hero Phase",
      "effect": "Set up a **Doomblast Dirgehorn** wholly within 18\" of the chanter.",
      "keywords": [
        "**^^SPELL^^**",
        "**^^SUMMON^^**"
      ],
      "declare": "If there is not a friendly **Doomblast Dirgehorn** on the battlefield, pick a friendly **^^Beasts of Chaos Wizard^^** to cast this spell, then make a casting roll of 2D6.",
      "color": "Yellow",
      "abilityCategory": "Special"
    },
    {
      "name": "Summon Ravening Direflock",
      "castingValue": 7,
      "timing": "Your Hero Phase",
      "effect": "Set up a **Ravening Direflock** wholly within 18\" of the caster and more than 9\" from all enemy units. A **Ravening Direflock** has 3 parts that must each be set up within 1\" of at least 1 other part.",
      "keywords": [
        "**^^SPELL^^**",
        "**^^SUMMON^^**"
      ],
      "declare": "If there is not a friendly **Ravening Direflock** on the battlefield, pick a friendly **^^Beasts of Chaos Wizard^^** to cast this spell, then make a casting roll of 2D6.",
      "color": "Yellow",
      "abilityCategory": "Special"
    },
    {
      "name": "Summon Wildfire Taurus",
      "castingValue": 7,
      "timing": "Your Hero Phase",
      "effect": "Set up a **Wildfire Taurus** wholly within 18\" of the caster and more than 9\" from all enemy units.",
      "keywords": [
        "**^^SPELL^^**",
        "**^^SUMMON^^**"
      ],
      "declare": "If there is not a friendly **Wildfire Taurus** on the battlefield, pick a friendly **^^Beasts of Chaos Wizard^^** to cast this spell, then make a casting roll of 2D6.",
      "color": "Yellow",
      "abilityCategory": "Special"
    }
  ]
}
