{
  "$schema": "https://wargamedata.com/aos4/schema/lore.schema.json",
  "id": "manifestation-lore-knights-of-the-crimson-keep",
  "name": "Manifestation Lore: Knights of the Crimson Keep",
  "loreType": "manifestation",
  "_meta": {
    "lastUpdated": "2026-01-08",
    "source": "BSData import"
  },
  "spells": [
    {
      "name": "Summon Unholy Reliquary",
      "castingValue": 6,
      "timing": "Your Hero Phase",
      "effect": "Set up a **Unholy Reliquary** endless spell wholly within 18\" of the caster.",
      "keywords": [
        "**^^SPELL^^**",
        "**^^SUMMON^^**"
      ],
      "declare": "If there is not a friendly **Unholy Reliquary** on the battlefield, pick a friendly **^^Soulblight Gravelords Wizard^^** to cast this spell, then make a casting roll of 2D6.",
      "color": "Yellow",
      "abilityCategory": "Special"
    }
  ]
}
