{
  "$schema": "https://wargamedata.com/aos4/schema/lore.schema.json",
  "id": "spell-lore-the-eternal-nightmare",
  "name": "Spell Lore: The Eternal Nightmare",
  "loreType": "spell",
  "_meta": {
    "lastUpdated": "2026-01-08",
    "source": "BSData import"
  },
  "spells": [
    {
      "name": "Divine Terror",
      "castingValue": 5,
      "timing": "Your Hero Phase",
      "effect": "Subtract 3 from the target's control score for the rest of the turn.",
      "keywords": [
        "**^^SPELL^^**",
        "**^^UNLIMITED^^**"
      ],
      "declare": "Pick a friendly **^^Eternal Nightmare Wizard^^** to cast this spell, pick a visible enemy unit within 18\" of them to be the target, then make a casting roll of 2D6.",
      "color": "Yellow",
      "abilityCategory": "Control"
    },
    {
      "name": "The Will of Nagash",
      "castingValue": 8,
      "timing": "Your Hero Phase",
      "effect": "Until the start of your next turn, if the unmodified hit roll or unmodified wound roll for an attack that targets thet arget unit is 1-3, the attack fails and the attack sequence ends.",
      "keywords": [
        "**^^SPELL^^**"
      ],
      "declare": "Pick a friendly **^^Eternal Nightmare Wizard^^** to cast this spell, pick a visible friendly **^^Eternal Nightmare Infantry^^** unit wholly within 12\" of them to be the target, then make a casting roll of 2D6.",
      "color": "Yellow",
      "abilityCategory": "Defensive"
    }
  ]
}
