{
  "$schema": "https://wargamedata.com/aos4/schema/lore.schema.json",
  "id": "spell-lore-astral-templars",
  "name": "Spell Lore: Astral Templars",
  "loreType": "spell",
  "_meta": {
    "lastUpdated": "2026-01-08",
    "source": "BSData import"
  },
  "spells": [
    {
      "name": "Primal Blizzard",
      "castingValue": 6,
      "timing": "Your Hero Phase",
      "effect": "Roll a dice for each model in the target unit. For each 6, inflict 1 mortal damage on the target.",
      "keywords": [
        "**^^SPELL^^**",
        "**^^UNLIMITED^^**"
      ],
      "declare": "Pick a friendly **^^Astral Templars Wizard^^** to cast this spell, pick a visible enemy unit within 18\" of them to be the target, then make a casting roll of 2D6."
    },
    {
      "name": "Hunter's Wings",
      "castingValue": 6,
      "timing": "Your Hero Phase",
      "effect": "Until the start of your next turn:\n• Add 3 to the target's Move characteristic.\n• Subtract 1 from hit rolls and wound rolls for shooting attacks that target the target unit.",
      "keywords": [
        "**^^SPELL^^**",
        "**^^UNLIMITED^^**"
      ],
      "declare": "Pick a friendly **^^Astral Templars Wizard^^** to cast this spell, pick a visible friendly unit wholly within 12\" of them to be the target, then make a casting roll of 2D6."
    }
  ]
}
