{
  "$schema": "https://aos-data.org/schema/lore.schema.json",
  "id": "prayer-lore-draconith-skywing",
  "name": "Prayer Lore: Draconith Skywing",
  "loreType": "prayer",
  "_meta": {
    "lastUpdated": "2026-01-06",
    "source": "BSData import"
  },
  "prayers": [
    {
      "name": "Sanctification",
      "chantingValue": 4,
      "timing": "Your Hero Phase",
      "effect": "Until the start of your next turn, subtract 1 from casting rolls for enemy **^^Wizards^^** while they are within 30\" of the chanter. If the chanting roll was 12+, subtract 1 from casting rolls for enemy **^^Wizards^^** for the rest of the battle and friendly **^^Priests^^** cannot use this ability again for the rest of the battle.",
      "keywords": [
        "**^^PRAYER^^**"
      ],
      "declare": "Pick a friendly **^^Draconith Skywing Priest^^** to chant this prayer, then make a chanting roll of D6.",
      "color": "Yellow",
      "abilityCategory": "Special"
    },
    {
      "name": "Sigmar's Grace",
      "chantingValue": 4,
      "timing": "Your Hero Phase",
      "effect": "**Heal (D3)** the target. If the chanting roll was 8+, **Heal (2D3)** the target instead.",
      "keywords": [
        "**^^PRAYER^^**",
        "**^^UNLIMITED^^**"
      ],
      "declare": "Pick a friendly **^^Draconith Skywing Priest^^** to chant this prayer, pick a friendly **^^Draconith Skywing^^** unit wholly within 12\" of them to be the target, then make a chanting roll of D6.",
      "color": "Yellow",
      "abilityCategory": "Defensive"
    }
  ]
}
