{
  "$schema": "https://aos-data.org/schema/lore.schema.json",
  "id": "lore-of-primal-jungles",
  "name": "Lore of Primal Jungles",
  "loreType": "spell",
  "_meta": {
    "lastUpdated": "2026-01-06",
    "source": "BSData import"
  },
  "spells": [
    {
      "name": "Empowered Celestite",
      "castingValue": 7,
      "timing": "Your Hero Phase",
      "effect": "Add 1 to the Rend characteristic of the target’s melee weapons for the rest of the turn.",
      "keywords": [
        "**^^SPELL^^**"
      ],
      "declare": "Pick a friendly **^^Seraphon Wizard^^** to cast this spell, pick a visible friendly **^^Saurus^^** unit wholly within 12\" of them to be the target, then make a casting roll of 2D6.",
      "color": "Yellow",
      "abilityCategory": "Offensive"
    },
    {
      "name": "Light of Chotec",
      "castingValue": 6,
      "timing": "Your Hero Phase",
      "effect": "Roll a number of dice equal to the number of damage points the target has. For each 4+, **Heal (1)** the target.",
      "keywords": [
        "**^^SPELL^^**",
        "**^^UNLIMITED^^**"
      ],
      "declare": "Pick a friendly **^^Seraphon Wizard^^** to cast this spell, pick a visible friendly **^^Seraphon^^** unit wholly within 12\" of them to be the target, then make a casting roll of 2D6.",
      "color": "Yellow",
      "abilityCategory": "Defensive"
    },
    {
      "name": "The Earth Trembles",
      "castingValue": 8,
      "timing": "Your Hero Phase",
      "effect": "Draw a straight line between the target point and the closest part on the caster’s base. Roll a D3 for each unit (friendly and enemy) that has models passed across by this line. On a 2+, inflict an amount of mortal damage on that unit equal to the roll.",
      "keywords": [
        "**^^SPELL^^**"
      ],
      "declare": "Pick a friendly **^^Seraphon Wizard^^** to cast this spell, pick a point on the battlefield within 18\" of them to be the target point, then make a casting roll of 2D6.",
      "color": "Yellow",
      "abilityCategory": "Offensive"
    }
  ]
}
