{
  "$schema": "https://wargamedata.com/aos4/schema/lore.schema.json",
  "id": "prayers-of-the-stormhosts",
  "name": "Prayers of the Stormhosts",
  "loreType": "prayer",
  "_meta": {
    "lastUpdated": "2026-01-08",
    "source": "BSData import"
  },
  "prayers": [
    {
      "name": "Bless Weapons",
      "chantingValue": 6,
      "timing": "Your Hero Phase",
      "effect": "Add 1 to the Attacks characteristic of the target’s melee weapons until the start of your next turn. If the chanting roll was 12+, this ability affects all visible friendly **^^Stormcast Eternals^^** units wholly within 12\" of the chanter.",
      "keywords": [
        "**^^PRAYER^^**"
      ],
      "declare": "Pick a friendly **^^Stormcast Eternals Priest^^** to chant this prayer, pick a visible friendly **^^Stormcast Eternals Infantry^^** unit wholly within 12\" of them to be the target, then make a chanting roll of D6.",
      "color": "Yellow",
      "abilityCategory": "Offensive"
    },
    {
      "name": "Translocation",
      "chantingValue": 4,
      "timing": "Your Hero Phase",
      "effect": "Remove the target from the battlefield and set it up again on the battlefield more than 9\" from all enemy units. In addition, if the chanting roll was 8+, subtract 1 from hit rolls for attacks that target that unit for the rest of the battle round.",
      "keywords": [
        "**^^PRAYER^^**"
      ],
      "declare": "Pick a friendly **^^Stormcast Eternals Priest^^** to chant this prayer, pick a visible friendly **^^Stormcast Eternals^^** unit wholly within 12\" of them to be the target, then make a chanting roll of D6.",
      "color": "Yellow",
      "abilityCategory": "Movement"
    },
    {
      "name": "Healing Storm",
      "chantingValue": 4,
      "timing": "Your Hero Phase",
      "effect": "Heal (D3) the target. If the chanting roll was 8+, **Heal (D3)** each visible friendly **^^Stormcast Eternals^^** unit wholly within 12\" of the chanter instead.",
      "keywords": [
        "**^^PRAYER^^**",
        "**^^UNLIMITED^^**"
      ],
      "declare": "Pick a friendly **^^Stormcast Eternals Priest^^** to chant this prayer, pick a visible friendly **^^Stormcast Eternals^^** unit wholly within 12\" of them to be the target, then make a chanting roll of D6.",
      "color": "Yellow",
      "abilityCategory": "Defensive"
    }
  ]
}
