{
  "$schema": "https://aos-data.org/schema/lore.schema.json",
  "id": "manifestation-lore-big-waaagh",
  "name": "Manifestation Lore: Big Waaagh!",
  "loreType": "spell",
  "_meta": {
    "lastUpdated": "2026-01-08",
    "source": "BSData import"
  },
  "spells": [
    {
      "name": "Summon Foot of Gork",
      "castingValue": 7,
      "timing": "Your Hero Phase",
      "effect": "Set up a **Foot of Gork** wholly within 12\" of the caster, visible to them and more than 9\" from all enemy units. A **Foot of Gork** has 2 parts that must be set up within 9\" of each other.",
      "keywords": [
        "**^^SPELL^^**",
        "**^^SUMMON^^**"
      ],
      "declare": "If there is not a friendly **Foot of Gork** on the battlefield, pick a friendly **^^Kruleboyz Wizard^^** to cast this spell, then make a casting roll of 2D6.",
      "color": "Yellow",
      "abilityCategory": "Special"
    }
  ]
}
