{
  "$schema": "https://aos-data.org/schema/lore.schema.json",
  "id": "lore-of-the-clammy-dank",
  "name": "Lore of the Clammy Dank",
  "loreType": "spell",
  "_meta": {
    "lastUpdated": "2026-01-08",
    "source": "BSData import"
  },
  "spells": [
    {
      "name": "The Hand of Gork",
      "castingValue": 7,
      "timing": "Your Hero Phase",
      "effect": "Remove the target from the battlefield and set it up again on the battlefield wholly within 24\" of the caster and more than 9\" from all enemy units.",
      "keywords": [
        "**^^SPELL^^**"
      ],
      "declare": "Pick a friendly **^^Gloomspite Gitz Wizard^^** to cast this spell, pick a visible friendly unit wholly within 12\" of them and not in combat to be the target, then make a casting roll of 2D6.",
      "color": "Yellow",
      "abilityCategory": "Movement"
    },
    {
      "name": "Spore Maws",
      "castingValue": 7,
      "timing": "Your Hero Phase",
      "effect": "Roll a D3 for each target. On a 2+, inflict an amount of mortal damage on the target equal to the roll.",
      "keywords": [
        "**^^SPELL^^**"
      ],
      "declare": "Pick a friendly **^^Gloomspite Gitz Wizard^^** to cast this spell, pick up to 3 visible enemy units within 12\" of them to be the targets, then make a casting roll of 2D6.",
      "color": "Yellow",
      "abilityCategory": "Offensive"
    },
    {
      "name": "Bad Portents",
      "castingValue": 6,
      "timing": "Your Hero Phase",
      "effect": "Roll a dice. On a 1-2, nothing happens. On a 3-5, the face of the Bad Moon moves to the next face. On a 6, pick a new face of the Bad Moon for this battle round.",
      "keywords": [
        "**^^SPELL^^**",
        "**^^UNLIMITED^^**"
      ],
      "declare": "Pick a friendly **^^Gloomspite Gitz Wizard^^** to cast this spell, then make a casting roll of 2D6.",
      "color": "Yellow",
      "abilityCategory": "Special"
    }
  ],
  "factionId": "gloomspite-gitz"
}
