{
  "$schema": "https://aos-data.org/schema/lore.schema.json",
  "id": "manifestation-lore-heroes-of-the-first-forged",
  "name": "Manifestation Lore: Heroes of the First-Forged",
  "loreType": "spell",
  "_meta": {
    "lastUpdated": "2026-01-08",
    "source": "BSData import"
  },
  "spells": [
    {
      "name": "Summon Everblaze Comet",
      "castingValue": 8,
      "timing": "Your Hero Phase",
      "effect": "Set up an **Everblaze Comet** wholly within 18\" of the caster.",
      "keywords": [
        "**^^SPELL^^**",
        "**^^SUMMON^^**"
      ],
      "declare": "If there is not a friendly **Everblaze Comet** on the battlefield, pick a friendly **^^Stormcast Eternals Wizard^^** to cast this spell, then make a casting roll of 2D6.",
      "color": "Yellow",
      "abilityCategory": "Special"
    }
  ]
}
